export_id,id,title,category,category_label,section,source,keywords,content,last_updated
61,1758198264053,Debt Relief Order,collections-account,Collections & Account Status Management,Manual Entry,Manual Entry,DRO | Relief | Debt Relief | Insolvency | debt management | order,"A Debt Relief Order (DRO) is a formal insolvency tool designed for individuals with low income, minimal assets, and relatively small unsecured debts who are unable to repay their creditors. DROs provide a structured mechanism for managing qualifying debts while offering a clear path to debt write-off.

Key Features:

Debt Eligibility: Unsecured debts, including credit cards, personal loans, overdrafts, utility arrears, and other qualifying debts. Current debt limit: £30,000 (England & Wales).

Eligibility Criteria:

Total qualifying debts ≤ £30,000

Limited assets (generally no more than £2,000, excluding certain essential items)

Low disposable income (typically less than £75 per month after essential outgoings)

Must not have had a DRO in the past six years

Duration: Standard DRO period is 12 months. If circumstances remain unchanged, qualifying debts are written off at the end of this period.

Credit Impact: DROs remain on the individual’s credit file for six years, affecting future credit applications.

Application Process:

Must be completed through an approved intermediary (debt adviser from an approved organisation).

A one-off fee of £90 is payable before submission.

Effect During DRO: Creditors included in the DRO cannot pursue repayment while the order is active.

Considerations for Staff:

DROs are suitable only for those meeting strict eligibility criteria; staff should verify circumstances carefully.

While DROs provide debt relief, they have long-term implications for the customer’s credit rating and financial options.

Staff should advise customers of alternative solutions if DROs are not appropriate.",2025-09-18
62,1758198812630,Handling Customer DRO Notifications,application-processing,Application Processing & General Operations,Manual Entry,Manual Entry,DRO | procedure | Insolvency | DRO stage | debt relief order,"Purpose:
To ensure customer Debt Relief Orders (DROs) are recorded accurately and accounts are managed correctly in line with our internal processes and regulatory requirements.

Procedure:

Customer Notification:

If a customer contacts us to advise they have been approved for a DRO, the agent should:

Record the DRO reference number.

Record the DRO order date.

Record the official receiver or intermediary handling the DRO.

Verification:

If the DRO has been formally made, the agent must verify it on the Insolvency Service Register:

Insolvency Service Register

Copy and paste the verification information into the customer notes.

Account Management:

Move the account to the IVA/Bankruptcy stage in the system.

A task will automatically be raised for the Back Office team to action at a later date.

Notes:

Ensure all relevant information is recorded clearly in the customer notes.

Do not attempt to take further collection action on accounts under an active DRO.

Outcome:
Following this procedure ensures compliance, accurate record-keeping, and that the customer’s account is managed appropriately while under a DRO.",2025-09-18
63,1758199205870,Calculating Daily Interest,transaction-responses,Transaction Responses & Payment Issues,Manual Entry,Manual Entry,calculate | interest | daily interest | charge | queries,"Purpose:
To provide staff with a clear process for explaining how interest is applied and to calculate the daily interest charge for customer accounts.

Interest Rate:

We charge 0.8% per day on the outstanding principal balance.

Daily Interest Calculation:

Identify the outstanding principal on the customer account.

Multiply the principal by 0.8% (0.008) to calculate the daily interest charge.

Formula:

Daily Interest = Outstanding Principal × 0.008


Example Calculations:

Principal (£)	Daily Interest (£)
300	            2.40
500	            4.00
750	            6.00
1,000	        8.00
1,500	        12.00

Using the Table/Formula on Calls:

If a customer asks how much interest will be applied each day, staff can either:

Use the table for quick reference, or

Apply the formula to calculate the exact amount for the outstanding balance.

Notes:

Interest is calculated daily based on the current outstanding principal.

Do not include previously accrued interest when calculating daily interest — only use the current principal.

Ensure all calculations and explanations are clearly noted in the customer account.",2025-09-18
64,1758199711580,Early Settlements,application-processing,Application Processing & General Operations,Manual Entry,Manual Entry,early | settlement | settle early | ESF | pay early,"Purpose:
To explain how early settlements work and provide staff with a clear process to follow when customers request to pay their loan in full before the end of the agreed duration.

Key Points:

Customers can settle their loan early by paying:

The outstanding principal, and

The interest accrued up to the settlement date.

The settlement figure provided is valid only on the day it is quoted.

If payment is not made on the same day, the settlement figure will increase daily at a rate of 0.8% of the outstanding principal.

Advise the customer:

“This figure is valid for today only. If payment is not made today, the settlement figure will increase tomorrow by 0.8% of the outstanding principal.”

Note the account with the settlement figure given and the date.

Formula for Daily Settlement Increase:

Daily Increase = Outstanding Principal × 0.008


Example:

Outstanding principal: £1,000

Daily increase: £1,000 × 0.008 = £8.00

If the customer does not pay today, the quoted settlement figure will increase by £8.00 tomorrow.

Important Notes for Staff:

Always remind customers that early settlement saves them from paying further future interest, but the figure changes daily.

Ensure all settlement quotes and customer communications are recorded in the notes.

Do not attempt to fix a settlement figure beyond the day it is quoted.",2025-09-18
65,1758199927883,Contacting Customers in Insolvency,collections-account,Collections & Account Status Management,Manual Entry,Manual Entry,contacting | during insolvency | IVA | bankruptcy | DRO | Trust Deed | Sequestration,"No. Once a customer has entered an approved form of insolvency (e.g. Debt Relief Order, Individual Voluntary Arrangement, Bankruptcy, or Debt Management Plan through an appointed provider), we must not work directly with the customer regarding repayment of their debt.

Procedure for Staff:

Identify Insolvency Status:

Confirm the form of insolvency (e.g. DRO, IVA, Bankruptcy, DMP).

Record all relevant details in the customer notes (reference number, order date, name of Insolvency Practitioner/Official Receiver/DMP provider).

Verification:

Where applicable, verify on the Insolvency Register:
Insolvency Service Register

Copy and paste confirmation into customer notes.

Account Handling:

Move the account to the IVA/Bankruptcy stage in the system.

A back-office task will automatically be raised for further handling.

Communication:

Do not discuss repayment or collection directly with the customer.

Politely explain that all communications will now be managed via their appointed Insolvency Practitioner/Official Receiver/DMP provider.

Script Example for Agents:

“As your account is now under an approved form of insolvency, we’re not able to discuss repayment directly with you. From this point forward, all matters will be handled by your Insolvency Practitioner/Official Receiver, and we will work directly with them on your account.”

Key Compliance Note:
Contacting customers directly to seek repayment after insolvency has been approved may breach regulatory obligations and consumer duty principles. All communication must go through the appointed insolvency representative.",2025-09-18
66,1758200055828,Insolvency Orders Made Before Loan Approval,application-processing,Application Processing & General Operations,Manual Entry,Manual Entry,orders made before approval | IVA | bankruptcy | dro | trust deed | sequestration | customer took loan after | applied | loan,"Scenario:
A customer advises (or it is identified) that they had an insolvency order (e.g. DRO, IVA, Bankruptcy) in place before they took out the loan.

Key Point:

If the insolvency order was already made before the loan agreement was taken out, the customer’s current loan is not included in that insolvency.

This means the customer remains liable for repayment under the original loan terms.

Procedure for Staff:

Check the insolvency order date against the loan start date.

If the insolvency order date is before the loan start date → the loan is not covered by that order.

If the insolvency order date is after the loan start date → follow the normal insolvency procedure (treat the loan as covered).

Record Details:

Note the insolvency order reference, date, and type in the account.

Record the loan start date for clarity.

Customer Communication:

If the loan is not covered by the insolvency order, explain clearly to the customer that the debt remains payable in full.

Example script:

“I can see that your insolvency order was made before this loan agreement started. This means your loan with us is not included in that arrangement, and you remain responsible for repayment under the original terms.”

Account Handling:

Continue managing the loan as normal (collections, interest, or settlement discussions) unless the customer later enters into a new insolvency arrangement that includes this loan.

Compliance Note:
It is important to distinguish between debts included in insolvency orders and those that fall outside due to being taken out afterwards. Always double-check dates and record them clearly.",2025-09-18
67,1758200491465,Cancelling a Schedule,application-processing,Application Processing & General Operations,Manual Entry,Manual Entry,undo | cancel CPA | cancel PP | cancel schedule | cancel,"Purpose:
To explain how agents can cancel a customer’s payment schedule and when this happens automatically.

Steps for Agents (Manual Cancellation):

Go to the account page of the customer’s account.

At the top of the page, locate the orange box titled “Schedules.”

Open the drop-down menu.

Select “Cancel Pay Plan.”

This will immediately cancel the active schedule on the account.

Automatic Cancellations:
A payment schedule will also cancel automatically if the account is moved into any of the following stages:

On Hold 1 Month

On Hold 2 Month

On Hold 3 Month

DM (Debt Management)

Vul (Vulnerability)

Pending Evidence

Important Notes for Staff:

Always confirm with the customer if they requested cancellation, and record the reason in the account notes.

Do not attempt to restart or amend a schedule without following the correct setup procedure.",2025-09-18
68,1758201330818,Customer Service Essentials,application-processing,Application Processing & General Operations,Manual Entry,Manual Entry,skills | good customer service | CS skills,"Purpose: Ensure all staff interact with customers in a professional, supportive, and compliant way.

Key Skills:

Tone: Always polite, empathetic, and professional, even in challenging conversations.

Active Listening: Let the customer speak, don’t interrupt, and acknowledge their concerns.

Plain English: Avoid jargon — explain things clearly and simply.

Empathy Statements: e.g. “I understand this must be difficult” or “Thank you for sharing that with me.”

Ownership: Take responsibility for helping resolve the query, even if you need to escalate.

Closing Calls/Emails: Summarise what was agreed and next steps.",2025-09-18
69,1758201606395,Dealing with Vulnerable Customers,application-processing,Application Processing & General Operations,Manual Entry,Manual Entry,Dealing with Vulnerable Customers | TEXAS | vul | special needs | support,"Purpose: To handle calls where customers disclose difficulties such as illness, financial hardship, or other vulnerabilities.

Steps:

Listen carefully and acknowledge what the customer has said.

Reassure them we can pause or adapt support if needed.

Move the account with to on hold - Vulnerability, if you agree a hold and note the reason. 

Add a ""must read note"" to make other staff aware of potential vulnerbility (this will show at the top of the general page)

Task the account for a review (dependant on what is agreed with the customer)

Provide information on free debt advice services if appropriate.

USse vulnerbility tools if needed i.e TEXAS

Escalate to a manager (Zoe Quick) if position is complex and you are unsure of how to handle the situation.",2025-09-18
70,1758201648742,Handling Difficult Conversations,application-processing,Application Processing & General Operations,Manual Entry,Manual Entry,angry customer | conflict resolution,"Purpose: To support staff when customers become upset, angry, or frustrated.

Top Tips:

Stay calm and professional — don’t match the customer’s tone.

Acknowledge their feelings: “I can hear you’re frustrated, let’s work through this together.”

Stick to facts and solutions, not emotions.

If the customer becomes abusive, politely warn them before ending the call.

Always record notes factually and without judgment.",2025-09-18
71,1758201846282,Understanding & Managing Customer Vulnerabilities,application-processing,Application Processing & General Operations,Manual Entry,Manual Entry,vulnerability | conditions | mental health | identifying | vul,"Purpose:
To help staff recognise and respond appropriately when customers disclose vulnerabilities, in line with Consumer Duty and treating customers fairly.

1. Health-Related Vulnerabilities

Examples: Physical disability, serious illness, mental health conditions, addiction, cognitive impairment.

How to Respond:

Show empathy and patience.

Offer to slow down the call or provide information in writing.

If needed, place account into VUL (Vulnerability) status.

Provide signposting to specialist support (e.g. debt charities, mental health helplines).

2. Financial Vulnerabilities

Examples: Job loss, reduced income, high cost of living, reliance on benefits, sudden financial shock (e.g. bereavement, separation).

How to Respond:

Explore affordable solutions (payment plans, short-term hold).

Place into On Hold stage if evidence is pending.

Remind them about free, impartial debt advice services.

Record notes clearly with context.

3. Situational Vulnerabilities

Examples: Bereavement, domestic abuse, caring responsibilities, divorce/separation, homelessness.

How to Respond:

Be sensitive to emotional impact.

Avoid pressing for immediate decisions.

Offer flexibility and note the account accordingly.

Escalate if safeguarding concerns arise (e.g. risk of harm).

4. Communication Barriers

Examples: Low literacy, English not first language, hearing or speech difficulties, limited access to digital tools.

How to Respond:

Adapt communication style — speak clearly, avoid jargon.

Offer alternative formats (email instead of phone, written confirmation).

Allow extra time on calls.

Record any preferences in account notes.

5. Age-Related Vulnerabilities

Examples: Elderly customers with reduced memory/understanding, very young customers with limited financial experience.

How to Respond:

Check understanding by asking the customer to repeat back.

Provide extra explanations where needed.

Be mindful of potential safeguarding concerns.

Escalate if exploitation or financial abuse is suspected.

6. Risk of Harm / Safeguarding

Examples: Suicidal thoughts, domestic abuse, threats of violence, immediate safety risks.

How to Respond:

Stay calm and listen.

If risk of immediate harm, follow emergency safeguarding procedure (e.g. contact emergency services if disclosure suggests life is in danger).

Escalate to a manager straight away.

Record facts only, not opinions.

Key Staff Reminders

Always note the vulnerability in the system using MUST READ NOTE and/or place into On Hold-Vulnerble stage, with the reason stated clearly.

Never judge or dismiss what the customer discloses.

Provide reassurance and explain what support options are available.

Escalate if unsure — better to check than mishandle a vulnerable customer.",2025-09-18
72,1758201922330,Vulnerabilities & Tools for Staff,application-processing,Application Processing & General Operations,Manual Entry,Manual Entry,tools | texas | IDEA | CARERS | vulnerability | vul,"Purpose:
To help staff identify, record, and manage customer vulnerabilities consistently and sensitively, using recognised industry tools.

1. Health-Related Vulnerabilities

Examples: Long-term illness, disability, mental health, addiction.

Tool: TEXAS Protocol (for handling disclosures)

Thank the customer for sharing.

Explain how the information will be used.

Xplicit consent — ask if you can record/share it internally.

Ask relevant questions (how it affects finances, any support needed).

Signpost to help (e.g. StepChange, Mind, Citizens Advice).

2. Financial Vulnerabilities

Examples: Job loss, reduced income, benefit reliance, cost-of-living pressures.

Tool: IDEA (for understanding impact)

Impact — how is the situation affecting them financially?

Duration — is it short-term, long-term, or permanent?

Experience — have they managed something similar before?

Adjustment — what support or changes do they need?

3. Situational Vulnerabilities

Examples: Bereavement, caring duties, domestic abuse, separation.

Tool: CARERS (for carers or dependent-related issues)

Check circumstances sensitively.

Assess how caring impacts finances/time.

Record disclosure with consent.

Explain available support.

Refer to advice organisations if appropriate.

Support flexibly (e.g. pauses, payment plans).",2025-09-18
73,1758202128463,Using IDEA with Customers,application-processing,Application Processing & General Operations,Manual Entry,Manual Entry,IDEA | vul | tools | understanding,"Purpose:
IDEA helps agents understand the customer’s situation more deeply when they disclose a vulnerability. It breaks the conversation into four areas: Impact, Duration, Experience, Adjustment.

I – Impact

What impact is the vulnerability having on their finances or ability to manage the account?

✅ Example questions:

“How is this situation affecting your ability to make payments right now?”

“Has this change impacted your income or expenses?”

✅ Example notes:

Customer unable to work due to surgery, now on reduced sick pay.

Customer’s mental health makes budgeting difficult.

D – Duration

Is the situation temporary, long-term, or permanent?

✅ Example questions:

“Do you expect this to change soon, or is it ongoing?”

“Has your GP or adviser said how long you may be in this situation?”

✅ Example notes:

Customer expects to return to work in 3 months after recovery.

Customer has long-term disability, likely ongoing.

E – Experience

Has the customer been through this before, and how did they manage?

✅ Example questions:

“Have you had to manage something like this before?”

“What’s helped you cope with your finances in the past?”

✅ Example notes:

Customer has been through redundancy before, relied on payment holidays.

Customer has never been in financial difficulty before, feels anxious and unsure.

A – Adjustment

What changes, support, or solutions are needed now?

✅ Example questions:

“What would help make things more manageable for you right now?”

“Would a short-term hold or reduced payment plan give you some breathing space?”

✅ Example notes:

Customer requests 2-month payment hold until benefits start.

Customer would like smaller instalments for 6 months.

Putting It All Together – Example Call Notes

IDEA applied:

Impact: Customer off work due to broken leg, income dropped to statutory sick pay.

Duration: Doctor says recovery expected in 12 weeks.

Experience: Customer previously managed using savings, but has none left now.

Adjustment: Customer requests a temporary hold on payments until return to work.",2025-09-18
74,1758202196993,Using CARERS with Customers,application-processing,Application Processing & General Operations,Manual Entry,Manual Entry,carers | support | vul | tools,"Purpose:
The CARERS tool helps agents handle disclosures where customers are carers, or where caring responsibilities are affecting their finances and account management.

C – Check circumstances sensitively

Understand the customer’s caring situation without being intrusive.

✅ Example questions:

“Can I ask a little more about your caring responsibilities, so I can understand how it affects your account?”

“Who do you provide care for, and how much time does this take each day?”

✅ Example notes:

Customer caring full-time for elderly parent with dementia.

Customer provides part-time care for disabled child alongside work.

A – Assess how caring impacts finances/time

Does caring reduce income, increase expenses, or affect their ability to make payments?

✅ Example questions:

“Does your caring role affect your ability to work or manage finances?”

“Do you have extra costs linked to caring, such as travel or equipment?”

✅ Example notes:

Customer reduced to part-time work due to caring role.

Customer has increased household costs, no spare income.

R – Record disclosure with consent

Always ask before noting sensitive details.

✅ Example script:

“Would you be happy for me to make a note of this on your account, so we can make sure we support you properly?”

✅ Example notes:

Consent given. Recorded customer caring for disabled child; limited availability during working hours.

E – Explain available support

Tell the customer how we can help manage their account fairly.

✅ Example script:

“We can look at putting your account on hold, adjusting your payment plan, or finding a schedule that works around your circumstances.”

R – Refer to advice organisations if appropriate

Signpost to specialist support.

✅ Examples:

Carers UK (www.carersuk.org
)

Citizens Advice

Local authority carers’ services

✅ Example script:

“There are organisations that can support carers with financial and emotional help — would you like me to share their details?”

S – Support flexibly

Put in place adjustments to help the customer manage.

✅ Examples:

Place account into On Hold (VUL) while circumstances are reviewed.

Offer flexible repayment dates that match benefit/payment cycles.

Allow more time for evidence if requested.

Putting It All Together – Example Call Notes

CARERS applied:

Check: Customer provides daily care for disabled spouse.

Assess: Reduced working hours, lower income, increased household costs.

Record: Consent given; noted in account.

Explain: Advised account could be placed on hold pending review.

Refer: Provided details for Carers UK.

Support: Account placed into VUL stage; repayment plan to be reviewed in 3 months.",2025-09-18
75,1758202663656,Abbreviations Log,application-processing,Application Processing & General Operations,Manual Entry,Manual Entry,abbreviatiions | shorthand | meanings,"Purpose:
Quick reference for staff to understand common abbreviations used in customer accounts, communications, and internal processes.

Account Stages & Holds

On Hold 1/2/3 – Account temporarily paused for review.

DM – Debt Management hold.

VUL – Vulnerable customer hold.

IVA – Individual Voluntary Arrangement.

DRO – Debt Relief Order.

BNK – Bankruptcy.

Processes & Actions

CB – Call Back.

LM – Left Message.

NA – No Answer.

CATC – Collection Action To Continue.

ES – Early Settlement.

RTW – Right To Withdraw.

Customer & Payment Terms

BTW - Back to work.

OOW - Out of work.

EOM - End of month.

Cust – Customer.

BT – Bank Transfer.

CPA – Continuous Payment Authority.

Paym – Payment.

CIF – Clear In Full.

Clr – Cleared.

mnth – Month.

rec'd – Received.

Vulnerability Tools & Protocols

TEXAS – Thank, Explain, eXplicit consent, Ask, Signpost.

IDEA – Impact, Duration, Experience, Adjustment.

CARERS – Check, Assess, Record, Explain, Refer, Support.

BRUCE – Behaviour, Remember, Understand, Check, Explore.

Credit & Collections References

CRS – Credit Resource Solutions.

UKS – UK Search.

DRA – Digital DRA.

Interest & Balances

OS – Outstanding Balance (principal + accrued interest).

INT – Daily Interest applied (0.8% per day of outstanding principal).",2025-10-15
